{
  "version": "0.19.0",
  "generated": "2026-10-11",
  "plays_snapshot": "2026-10-11",
  "method": "The Chronicle: sessions (data/sessions.json, enriched by data/v1/session-clusters.json), dated milestones (data/v1/milestones.json - the longest silence is a span, dated at its start with end_date carried), and one event per title-credited collaboration appearance (data/v1/circle.json, release page resolved by exact title+date join against data/sessions.json and data/artist.json). Merged and sorted chronologically; same-date order is milestone -> session -> collaboration (a stated presentation rule). Era by calendar year via data/v1/eras.json; the 2017 feature credit predates the eras ('Before the vault'). Powers chronicle.html.",
  "kinds": [
    "milestone",
    "session",
    "collaboration"
  ],
  "same_date_order": [
    "milestone",
    "session",
    "collaboration"
  ],
  "eras": [
    {
      "id": "the-first-rite",
      "name": "The First Rite",
      "years": [
        "2018",
        "2019"
      ]
    },
    {
      "id": "the-prolific-year",
      "name": "The Prolific Year",
      "years": [
        "2020"
      ]
    },
    {
      "id": "the-cast-it-years",
      "name": "The Cast It: Years",
      "years": [
        "2021",
        "2022"
      ]
    },
    {
      "id": "the-somelowlifes-era",
      "name": "The SomeLowLifes Era",
      "years": [
        "2023",
        "2024"
      ]
    },
    {
      "id": "the-silence",
      "name": "The Silence",
      "years": [
        "2025"
      ]
    },
    {
      "id": "the-return",
      "name": "The Return",
      "years": [
        "2026"
      ]
    }
  ],
  "collaborators": [
    {
      "slug": "max-ferrari",
      "name": "Max Ferrari",
      "page": "circle/index.html#c-max-ferrari",
      "appearances": 8
    },
    {
      "slug": "yung-vetta",
      "name": "Yung Vetta",
      "page": "circle/index.html#c-yung-vetta",
      "appearances": 7
    },
    {
      "slug": "jax",
      "name": "JAX",
      "page": "circle/index.html#c-jax",
      "appearances": 3
    },
    {
      "slug": "lil-yu",
      "name": "lil yu",
      "page": "circle/index.html#c-lil-yu",
      "appearances": 3
    },
    {
      "slug": "griimxo",
      "name": "Griimxo",
      "page": "circle/index.html#c-griimxo",
      "appearances": 2
    },
    {
      "slug": "jo-e-dripp",
      "name": "JO$E DRIPP",
      "page": "circle/index.html#c-jo-e-dripp",
      "appearances": 2
    },
    {
      "slug": "lilvicbxi",
      "name": "LILVICBXI",
      "page": "circle/index.html#c-lilvicbxi",
      "appearances": 2
    },
    {
      "slug": "lil-wintr",
      "name": "Lil Wintr",
      "page": "circle/index.html#c-lil-wintr",
      "appearances": 2
    },
    {
      "slug": "marcelo",
      "name": "Marcelo",
      "page": "circle/index.html#c-marcelo",
      "appearances": 2
    },
    {
      "slug": "capoxxo",
      "name": "capoxxo",
      "page": "circle/index.html#c-capoxxo",
      "appearances": 2
    },
    {
      "slug": "ammi-age",
      "name": "AMMI $AGE",
      "page": "circle/index.html#c-ammi-age",
      "appearances": 1
    },
    {
      "slug": "keyblayde808",
      "name": "Keyblayde808",
      "page": "circle/index.html#c-keyblayde808",
      "appearances": 1
    },
    {
      "slug": "lilrareboy",
      "name": "Lilrareboy",
      "page": "circle/index.html#c-lilrareboy",
      "appearances": 1
    },
    {
      "slug": "max",
      "name": "Max",
      "page": "circle/index.html#c-max",
      "appearances": 1
    },
    {
      "slug": "offline-hp",
      "name": "Offline_hp",
      "page": "circle/index.html#c-offline-hp",
      "appearances": 1
    },
    {
      "slug": "shola",
      "name": "Shola",
      "page": "circle/index.html#c-shola",
      "appearances": 1
    },
    {
      "slug": "vetty",
      "name": "Vetty",
      "page": "circle/index.html#c-vetty",
      "appearances": 1
    },
    {
      "slug": "yung-cortex",
      "name": "Yung Cortex",
      "page": "circle/index.html#c-yung-cortex",
      "appearances": 1
    },
    {
      "slug": "lil-soda-boi",
      "name": "lil soda boi",
      "page": "circle/index.html#c-lil-soda-boi",
      "appearances": 1
    },
    {
      "slug": "phil-is-lonely",
      "name": "phil is lonely",
      "page": "circle/index.html#c-phil-is-lonely",
      "appearances": 1
    },
    {
      "slug": "pvscale",
      "name": "pvscale",
      "page": "circle/index.html#c-pvscale",
      "appearances": 1
    }
  ],
  "events": [
    {
      "id": "first-distributor",
      "date": "2017-04-20",
      "kind": "milestone",
      "era_id": null,
      "era_name": "Before the vault",
      "title": "First distributor transmission",
      "detail": "The catalog's first appearance on streaming platforms — as a featured artist, two years before the first vault upload. — “lost memories (feat. Aster Da Master)”",
      "plays": null,
      "links": [
        {
          "label": "Release page",
          "href": "releases/lost-memories-feat-aster-da-master.html"
        },
        {
          "label": "Release page",
          "href": "releases/lost-memories-feat-aster-da-master.html"
        }
      ],
      "collaborators": [],
      "collab_slug": null
    },
    {
      "id": "first-vault",
      "date": "2018-01-03",
      "kind": "milestone",
      "era_id": "the-first-rite",
      "era_name": "The First Rite",
      "title": "First vault transmission",
      "detail": "The first upload to the official SoundCloud — and it arrived already carrying five figures of plays. The opening shot was not a warm-up. — “Soul Shaking (prod. Fish Narc)”",
      "plays": 12944,
      "links": [
        {
          "label": "Release page",
          "href": "releases/soul-shaking-prod-fish-narc.html"
        }
      ],
      "collaborators": [],
      "collab_slug": null
    },
    {
      "id": "session-01",
      "date": "2018-01-03",
      "kind": "session",
      "era_id": "the-first-rite",
      "era_name": "The First Rite",
      "title": "The January 3rd–8th Session",
      "detail": "2 transmissions, 13,862 plays",
      "plays": 13862,
      "links": [
        {
          "label": "Session card",
          "href": "sessions-explorer.html#card-session-01"
        }
      ],
      "collaborators": []
    },
    {
      "id": "session-02",
      "date": "2018-02-04",
      "kind": "session",
      "era_id": "the-first-rite",
      "era_name": "The First Rite",
      "title": "The February 4th Session",
      "detail": "1 transmissions, 30,088 plays",
      "plays": 30088,
      "links": [
        {
          "label": "Session card",
          "href": "sessions-explorer.html#card-session-02"
        }
      ],
      "collaborators": []
    },
    {
      "id": "session-03",
      "date": "2018-03-16",
      "kind": "session",
      "era_id": "the-first-rite",
      "era_name": "The First Rite",
      "title": "The March 16th Session",
      "detail": "1 transmissions, 1,008 plays",
      "plays": 1008,
      "links": [
        {
          "label": "Session card",
          "href": "sessions-explorer.html#card-session-03"
        }
      ],
      "collaborators": []
    },
    {
      "id": "first-collab",
      "date": "2018-04-28",
      "kind": "milestone",
      "era_id": "the-first-rite",
      "era_name": "The First Rite",
      "title": "First collaboration",
      "detail": "The first transmission to summon another voice. The circle starts here and grows to twenty-one collaborators. — “Mistakes Ft. JO$E DRIPP (prod. Tec)”",
      "plays": 1400,
      "links": [
        {
          "label": "Release page",
          "href": "releases/mistakes-ft-jo-e-dripp-prod-tec.html"
        },
        {
          "label": "Circle record",
          "href": "circle/index.html#c-jo-e-dripp"
        }
      ],
      "collaborators": [
        "JO$E DRIPP"
      ],
      "collab_slug": "jo-e-dripp"
    },
    {
      "id": "session-04",
      "date": "2018-04-28",
      "kind": "session",
      "era_id": "the-first-rite",
      "era_name": "The First Rite",
      "title": "The April 28th Session",
      "detail": "1 transmissions, 1,400 plays",
      "plays": 1400,
      "links": [
        {
          "label": "Session card",
          "href": "sessions-explorer.html#card-session-04"
        }
      ],
      "collaborators": [
        "JO$E DRIPP"
      ]
    },
    {
      "id": "collab-jo-e-dripp-1",
      "date": "2018-04-28",
      "kind": "collaboration",
      "era_id": "the-first-rite",
      "era_name": "The First Rite",
      "title": "Mistakes Ft. JO$E DRIPP (prod. Tec)",
      "detail": "JO$E DRIPP on the record — 1,400 plays",
      "plays": 1400,
      "links": [
        {
          "label": "Release page",
          "href": "releases/mistakes-ft-jo-e-dripp-prod-tec.html"
        },
        {
          "label": "Circle page",
          "href": "circle/index.html#c-jo-e-dripp"
        },
        {
          "label": "Session",
          "href": "sessions-explorer.html#card-session-04"
        }
      ],
      "collaborators": [
        "JO$E DRIPP"
      ],
      "collab_slug": "jo-e-dripp"
    },
    {
      "id": "session-05",
      "date": "2018-06-08",
      "kind": "session",
      "era_id": "the-first-rite",
      "era_name": "The First Rite",
      "title": "The June 8th–14th Session",
      "detail": "2 transmissions, 3,030 plays",
      "plays": 3030,
      "links": [
        {
          "label": "Session card",
          "href": "sessions-explorer.html#card-session-05"
        }
      ],
      "collaborators": []
    },
    {
      "id": "session-06",
      "date": "2018-07-01",
      "kind": "session",
      "era_id": "the-first-rite",
      "era_name": "The First Rite",
      "title": "The July 1st Session",
      "detail": "1 transmissions, 1,282 plays",
      "plays": 1282,
      "links": [
        {
          "label": "Session card",